# GO	NS	enrichment	name	ratio_in_study	ratio_in_pop	p_uncorrected	depth	study_count	p_fdr_bh	study_items
GO:0006397	BP	e	mRNA processing	206/7672	334/15423	1.1391366769564868e-05	8	206	0.003303724190509203	A1cf, Ahcyl1, Akap8l, Alkbh5, Apobec1, App, Aqr, Aurkaip1, Brdt, Bud13, Bud31, C1qbp, Cactin, Cdc40, Cdc5l, Cdc73, Cdk12, Cdk13, Celf1, Cir1, Clp1, Cnot6l, Cpsf1, Cpsf4, Cpsf6, Cpsf7, Cstf1, Cstf2, Cstf3, Cwc15, Cwc22, Dcps, Ddx20, Ddx39b, Ddx46, Ddx5, Dhx15, Dhx16, Dhx38, Dhx40, Dhx8, Dhx9, Eif4a3, Ern1, Fam172a, Fastkd5, Fip1l1, Frg1, Gemin2, Gemin5, Gemin7, Gpkow, Grsf1, Hnrnpa2b1, Hnrnpf, Hnrnph1, Hnrnpk, Hnrnpll, Hnrnpm, Hnrnpu, Hsf1, Hspa8, Ik, Iws1, Jmjd6, Khdrbs1, Khdrbs3, Kin, Leo1, Lsm1, Lsm5, Luc7l3, Magoh, Mbnl1, Mbnl2, Mbnl3, Mtpap, Ncbp2, Nudt21, Pabpc1, Paf1, Pan3, Papola, Papolg, Pcf11, Pdcd11, Pde12, Phf5a, Phrf1, Plcb1, Plrg1, Ppie, Ppp1r8, Ppp4r2, Prpf18, Prpf19, Prpf38a, Prpf38b, Prpf39, Prpf4, Prpf4b, Prpf6, Prpf8, Ptbp1, Ptbp2, Ptbp3, Puf60, Qk, Rbbp6, Rbfox2, Rbm15b, Rbm17, Rbm20, Rbm22, Rbm26, Rbm27, Rbm28, Rbm38, Rbm39, Rbm4, Rbm41, Rbm4b, Rbm5, Rbmx, Rbmxl1, Rbpms, Rbpms2, Rnmt, Rnps1, Rprd1a, Rprd1b, Rprd2, Rpusd3, Rsrc1, Sart1, Sart3, Scaf1, Scaf4, Scaf8, Scnm1, Sf1, Sf3a1, Sf3a2, Sf3a3, Sf3b3, Sf3b4, Sf3b5, Sfpq, Sfswap, Slu7, Smn1, Smndc1, Smu1, Snrnp200, Snrnp25, Snrnp48, Snrpb, Snrpb2, Snrpd3, Snrpn, Son, Srek1, Srpk1, Srpk2, Srrm1, Srrm2, Srrm4, Srsf1, Srsf10, Srsf2, Srsf5, Srsf6, Srsf7, Srsf9, Ssu72, Strap, Supt6, Syf2, Sympk, Tardbp, Tbrg4, Thoc1, Thrap3, Tra2a, Tra2b, Trub2, Tsen34, Tut1, U2af1, U2af2, Ubl5, Usp39, Wbp4, Wdr33, Xab2, Xrn2, Ybx1, Ythdc1, Zc3h13, Zcchc8, Zcrb1, Zfp326, Zfp36l1, Zfp830, Zranb2, Zrsr1
GO:0006805	BP	e	xenobiotic metabolic process	61/7672	83/15423	1.2840176090601453e-05	3	61	0.0036508900684276797	Acaa1a, Acaa1b, Acsl1, Akr1c12, Akr1c13, Baat, Cdo1, Cryz, Csad, Cyp1a2, Cyp26a1, Cyp26b1, Cyp2a12, Cyp2a22, Cyp2a4, Cyp2a5, Cyp2b10, Cyp2c29, Cyp2c37, Cyp2c38, Cyp2c40, Cyp2c50, Cyp2c54, Cyp2c55, Cyp2c67, Cyp2c68, Cyp2c69, Cyp2c70, Cyp2d10, Cyp2d11, Cyp2d12, Cyp2d22, Cyp2d26, Cyp2d9, Cyp2e1, Cyp2f2, Cyp2g1, Cyp2j5, Cyp2j6, Cyp2j8, Cyp2j9, Cyp2r1, Gstm1, Gstm2, Gstm4, Gstm5, Gstm7, Gsto1, Hnf4a, Nceh1, Pon3, Stat5a, Stat5b, Sult1b1, Ugt1a1, Ugt1a10, Ugt1a2, Ugt1a6a, Ugt1a6b, Ugt1a9, Ugt2b1
GO:0043902	BP	e	positive regulation of multi-organism process	173/7672	276/15423	1.4770405652887489e-05	4	173	0.0041189548533177205	Adam8, Ago2, Aim2, Alpk1, Ankrd17, Ap1g1, Ar, Bcl10, Bcl2l11, Bmp6, C1qbp, Cav1, Cav2, Cd14, Cd160, Cd300lf, Cd74, Cd86, Ceacam1, Cfl1, Chd1, Chmp2b, Chmp3, Chmp4c, Clec4e, Cnot7, Colec12, Ctdp1, Cxcl1, Cyba, Ddb1, Ddx3x, Dhx9, Ednrb, Ep300, Epg5, Ereg, F2rl1, Gbp5, Gtf2b, H2-M3, Hdac2, Hdac4, Hexim1, Hmgb3, Hspa8, Hspd1, Hyal3, Ifi203, Ifi204, Ifi205, Ikbke, Il18rap, Inhbb, Irak1, Irak2, Irak3, Irf3, Irgm2, Jun, Klrk1, Kpna6, Lag3, Lamp1, Larp1, Lbp, Lhfpl2, Lrrfip2, Lsm14a, Ly96, Mapk3, Mapkapk2, Mapkapk3, Matr3, Mdfic, Med1, Mif, Mndal, Myd88, Nfkbia, Nlrc4, Nlrc5, Nod1, Nod2, Notch1, Nr5a2, Nucks1, Optn, Osbp, P2ry1, P2ry2, Pabpc1, Park7, Pde12, Pde3a, Peli1, Peli3, Pfn1, Pik3ap1, Pja2, Pkn2, Plcb1, Plscr1, Polr3b, Polr3c, Polr3f, Polr3g, Ppid, Ppie, Prf1, Prkca, Pum1, Pum2, Pvr, Rab7, Rad23a, Raet1d, Raet1e, Rasgrp1, Rbm14, Rela, Riok3, Ripk2, Rps19, Rsf1, Rtn4, Sash1, Sfpq, Sin3a, Slamf6, Smarcb1, Smc3, Smurf2, Srpk1, Srpk2, Stat5a, Stat5b, Stau1, Stom, Syde1, Taf11, Tbc1d20, Tbk1, Tifa, Tirap, Tlr1, Tlr11, Tlr13, Tlr2, Tlr6, Tmem173, Tmprss2, Tnip1, Tnip2, Traf3, Traf6, Trim30a, Tsg101, Txk, Ube2k, Unc13b, Unc93b1, Vapa, Vapb, Vav1, Vps4a, Vps4b, Wdfy1, Xrcc5, Xrcc6, Ythdc2, Zcchc3, Zfp639
GO:0036211	BP	e	protein modification process	987/7672	1813/15423	2.1176472904682887e-05	5	987	0.0056866672887186396	1810024B03Rik, Aak1, Abca1, Abhd13, Abhd17a, Abhd17c, Abi2, Abl2, Acp1, Acvr1, Acvr2b, Acvrl1, Adh5, Adprhl2, Agbl5, Agt, Agtr1a, Akt2, Akt3, Alg1, Alg5, Alg8, Alpk1, Amfr, Anapc1, Anapc2, Anapc5, Apoa2, App, Araf, Arel1, Arid4a, Arid4b, Arih2, Arrb1, Arrb2, Arrdc1, Arrdc4, Asb1, Asb2, Ash1l, Ash2l, Asxl1, Atat1, Ate1, Atg12, Atg16l1, Atg4b, Atg5, Atm, Atp7a, Atr, Atxn7, Atxn7l3, Axin1, B3galnt1, B3galt1, Babam1, Bap1, Baz2a, Bcl11a, Bcor, Bcr, Bend3, Bfar, Bgn, Birc2, Birc6, Blk, Bmp10, Bmp2k, Bmpr1a, Bmpr2, Braf, Brap, Brca2, Brcc3, Brd1, Brd4, Brms1l, Brpf1, Brpf3, Brsk1, Btg1, Btg2, Btk, C1galt1, C1galt1c1, Cab39, Cab39l, Cad, Camk1d, Camk2a, Camk2d, Camk4, Camkk2, Cand1, Cbfb, Cbl, Cblb, Cblc, Cbll1, Ccl5, Ccnt1, Cdc14b, Cdc27, Cdc42bpa, Cdc42bpb, Cdc42bpg, Cdc42ep5, Cdc73, Cdk11b, Cdk12, Cdk13, Cdk16, Cdk17, Cdk19, Cdk5r1, Cdk6, Cdk7, Cdk8, Cdk9, Ces2a, Cfl1, Chek1, Chfr, Chm, Chml, Chuk, Clk1, Clk3, Clk4, Clock, Cog3, Cog7, Coprs, Cops3, Cops5, Cops6, Cops7b, Crbn, Creb1, Crebbp, Crtap, Crtc2, Cry1, Csf1r, Csnk1d, Csnk1e, Csnk1g1, Csnk1g2, Csnk1g3, Csnk2a1, Csnk2a2, Csnk2b, Ctcfl, Ctdp1, Ctdsp2, Ctdspl2, Cth, Ctnnb1, Ctr9, Cttnbp2nl, Cul1, Cul3, Cul4b, Cul5, Cul9, Cyld, Dad1, Dapk1, Dcaf17, Dclk2, Dcun1d1, Dcun1d3, Dcun1d4, Dcun1d5, Ddah1, Ddb1, Ddb2, Ddrgk1, Desi2, Dgkq, Dguok, Dhps, Dld, Dlst, Dmpk, Dot1l, Dph1, Dph5, Dph6, Dr1, Dsp, Dstyk, Dtx2, Dtx3, Dtx4, Dusp1, Dusp11, Dusp12, Dusp16, Dusp23, Dusp4, Dusp5, Dusp6, Dusp7, Dusp8, Dyrk1a, Dyrk1b, Dyrk2, E030030I06Rik, Edem1, Edem3, Eed, Egf, Egfr, Egr2, Ehhadh, Ehmt1, Ehmt2, Eif2a, Eif2ak1, Eif2s1, Eif3f, Elk4, Entpd5, Eogt, Ep300, Ep400, Epc1, Ephb3, Ephb4, Erbb2, Erbb4, Ern1, Esco1, Esco2, Etf1, Ext1, Ext2, Extl2, Extl3, Eya3, Eya4, Ezh2, Fam98a, Fbxl17, Fbxl2, Fbxl21, Fbxl3, Fbxl5, Fbxl7, Fbxo11, Fbxo25, Fbxo7, Fbxo9, Fbxw11, Fbxw5, Fbxw7, Fem1b, Fer, Fes, Fgfr1, Fgfr2, Fut11, Fxn, Gak, Galnt18, Gan, Gcnt2, Gcsh, Gdf6, Gfpt1, Gfpt2, Ggcx, Ggnbp1, Gm5239, Golga7, Gphn, Gpx1, Grk4, Grk5, Gsk3a, Gspt1, Gtf2b, Gtf2h1, Gtf2h3, Gxylt1, Hccs, Hcfc1, Hdac2, Hdac3, Hdac4, Hdac5, Hectd1, Hecw2, Hemk1, Herc2, Herc4, Hhat, Hif1an, Hipk1, Hipk2, Hipk3, Hlcs, Hltf, Hmbs, Hsf1, Hspa8, Hspa9, Htatip2, Huwe1, Icmt, Igf1r, Ikbke, Il12rb2, Il15, Il1b, Ilkap, Ing5, Insr, Irak1, Irak2, Irak3, Irgm2, Itch, Itgav, Itpkb, Jak2, Jmjd1c, Jmjd6, Jmjd7, Josd1, Kansl1, Kansl2, Kansl3, Kars, Kat2b, Kat6a, Kat6b, Kat7, Kat8, Kbtbd8, Kcmf1, Kctd13, Kdelc1, Kdm1a, Kdm1b, Kdm2a, Kdm3a, Kdm4b, Kdm4c, Kdm5a, Kdm5b, Kdm5c, Kdm5d, Kdm6a, Kdm6b, Kdm8, Kdr, Klhl12, Klhl13, Klhl2, Klhl20, Klhl21, Klhl24, Klhl3, Klhl41, Klhl42, Klhl7, Kmt2a, Kmt2b, Kmt2c, Kmt2d, Ksr1, Lama1, Lats1, Leo1, Lias, Lmtk2, Loxl4, Ltn1, Lyn, Lypla1, Lztr1, Macrod1, Magt1, Maml1, Man2a1, Man2a2, Man2b1, Map2k4, Map2k5, Map2k7, Map3k1, Map3k11, Map3k13, Map3k14, Map3k15, Map3k2, Map3k3, Map3k4, Map3k5, Map3k7, Map3k8, Map4k2, Map4k3, Map4k4, Map4k5, Mapk1, Mapk15, Mapk3, Mapk8, Mapk8ip3, Mapk9, Mapkapk2, Mapkapk3, Mapkapk5, March2, March5, March6, March7, Mark2, Mast1, Mast4, Mastl, Matk, Mdm2, Meaf6, Med1, Med12, Med17, Med21, Med23, Med24, Med30, Med6, Med7, Mef2a, Met, Metap2, Mettl22, Mfng, Mgat1, Mgat2, Mgat4b, Mgrn1, Mib1, Mier1, Mier2, Mink1, Morc3, Morf4l1, Msl1, Msl2, Mta1, Mta2, Mtfmt, Mtm1, Mtmr3, Mtor, Mul1, Myc, Mycbp2, Myd88, Mylip, Mylk, Mylk3, Mysm1, Naa15, Naa16, Naa25, Naa30, Naa35, Naa40, Naa50, Nae1, Nat8, Nceh1, Ncoa6, Ndst1, Ndufab1, Ndufaf5, Ndufaf7, Nedd4l, Nek1, Nek7, Neurl1a, Neurl3, Nf1, Nfe2l1, Nfe2l2, Nfs1, Ngly1, Nhlrc3, Nktr, Nme2, Nmt2, Nos1, Notum, Npc1, Nr2c2, Nrbp2, Nsd1, Ntrk1, Oard1, Ogfod1, Ogt, Opn3, Otub1, Otud3, Otud5, Otud7b, Oxsr1, P4ha1, P4ha2, Paf1, Pak1, Pak2, Pak4, Pam, Pan3, Park7, Parp2, Parp6, Parp8, Pcgf3, Pcgf6, Pck1, Pcmtd2, Pcnp, Pdgfrb, Pdk1, Pdk2, Pdk3, Pdk4, Pdp2, Pdpk1, Pdzd4, Peli1, Peli2, Peli3, Pex12, Pgap1, Pgap2, Pggt1b, Phb, Phc1, Phf2, Phf20, Phf8, Phkg2, Phlpp1, Phlpp2, Pias1, Pias2, Piga, Pigb, Pigf, Pigk, Pigm, Pign, Pigp, Pigq, Pigt, Pigw, Pik3c3, Pik3ca, Pik3cg, Pik3r4, Pim3, Pink1, Pja1, Pja2, Pkd1, Pkdcc, Pkn1, Pkn2, Plk4, Plod1, Plod3, Pofut1, Pofut2, Pomgnt2, Porcn, Ppid, Ppie, Ppil2, Ppil4, Ppm1a, Ppm1b, Ppm1d, Ppm1e, Ppm1g, Ppm1k, Ppme1, Ppp1ca, Ppp1cc, Ppp1r15a, Ppp1r15b, Ppp1r1b, Ppp1r3c, Ppp2ca, Ppp2cb, Ppp2r2a, Ppp2r2d, Ppp2r3a, Ppp2r5a, Ppp2r5c, Ppp2r5d, Ppp3ca, Ppp3cc, Ppp3r1, Ppp4r2, Ppp5c, Ppp6c, Prdx3, Prkaa1, Prkaa2, Prkab1, Prkar1a, Prkar1b, Prkca, Prkcd, Prkcg, Prkch, Prkd3, Prkx, Prmt1, Prmt2, Prmt3, Prmt6, Prpf19, Prpf4b, Pskh1, Ptger4, Ptp4a2, Ptpn12, Ptpn14, Ptpn2, Ptpn23, Ptpn3, Ptpn9, Ptpra, Ptprb, Ptprd, Ptprf, Ptprk, Ptprm, Ptprn, Ptprs, Pwp1, Pxk, Pxn, Qpct, Rabggtb, Raf1, Ranbp2, Rbbp5, Rbbp6, Rbm14, Rc3h1, Rc3h2, Rchy1, Rcor1, Reln, Rest, Rffl, Rfwd3, Rgr, Rhbdd1, Rictor, Ripk2, Ripk3, Ripk4, Rlf, Rlim, Rnf10, Rnf111, Rnf115, Rnf13, Rnf138, Rnf139, Rnf14, Rnf141, Rnf144a, Rnf144b, Rnf146, Rnf152, Rnf157, Rnf167, Rnf185, Rnf19a, Rnf2, Rnf20, Rnf213, Rnf216, Rnf217, Rnf220, Rnf25, Rnf31, Rnf38, Rnf4, Rnf41, Rnf43, Rnft1, Rock1, Rock2, Rpap2, Rpn2, Rprd1a, Rprd1b, Rps27a, Rps6ka2, Rps6ka5, Rsrc1, Rtf1, Rybp, S100a9, Sash1, Satb1, Scyl2, Scyl3, Sde2, Sdhaf2, Senp1, Senp2, Senp3, Senp5, Senp6, Serp1, Serpina1a, Serpina1b, Setd1a, Setd1b, Setd2, Setd3, Setd6, Setd7, Setdb1, Setx, Sfpq, Sgk1, Sgk2, Sgk3, Sh3rf1, Shank3, Sharpin, Shc1, Shoc2, Shprh, Sik1, Sik2, Sik3, Sin3a, Sin3b, Sirt1, Sirt7, Skp1a, Sla, Slc35c1, Slk, Smad1, Smad4, Smad5, Smad9, Smg1, Smurf2, Smyd3, Snrpb, Snrpd3, Socs6, Socs7, Sox9, Spata2, Spsb2, Spsb4, Src, Srms, Srpk1, Srpk2, Ssh1, Ssh3, Ssu72, St3gal5, St6gal1, St6galnac3, St6galnac4, St8sia1, St8sia4, Stambpl1, Stat5a, Stk16, Stk17b, Stk24, Stk25, Stk3, Stk32c, Stk38, Stk39, Stk4, Stk40, Stradb, Stt3b, Stub1, Suds3, Sumo3, Syvn1, Tada1, Tada2a, Taf1, Taf12, Taf5l, Taf9, Taok1, Tbk1, Tbl1x, Tbl1xr1, Tcf3, Tec, Tesk2, Tet2, Tet3, Tex14, Tgfbr1, Thbs1, Tiparp, Tlk1, Tlk2, Tlr2, Tmem129, Tmtc1, Tmtc2, Tmtc3, Tmx3, Tnfaip3, Tnik, Tnk2, Tnks, Tnks2, Topors, Traf2, Traf6, Traf7, Trib1, Trib3, Trim2, Trim23, Trim27, Trim28, Trim3, Trim30a, Trim33, Trim47, Trim56, Trio, Trip11, Trmt112, Trpc4ap, Trpm7, Trrap, Tsg101, Ttbk2, Ttl, Ttll1, Ttll3, Ttll4, Txk, Uba1, Uba2, Uba52, Ubash3b, Ubb, Ubd, Ube2a, Ube2b, Ube2cbp, Ube2d2b, Ube2d3, Ube2e1, Ube2e3, Ube2g1, Ube2g2, Ube2h, Ube2i, Ube2j2, Ube2k, Ube2m, Ube2o, Ube2q2, Ube2r2, Ube2s, Ube2v1, Ube2v2, Ube3a, Ube3b, Ube4a, Ubl5, Ublcp1, Ubr1, Ubr3, Ubr5, Uchl3, Uchl5, Uevld, Ufl1, Uggt2, Uhmk1, Uhrf2, Ulk1, Ulk3, Usp1, Usp11, Usp14, Usp15, Usp16, Usp19, Usp20, Usp21, Usp22, Usp24, Usp25, Usp27x, Usp28, Usp3, Usp31, Usp33, Usp34, Usp37, Usp38, Usp39, Usp4, Usp46, Usp47, Usp54, Usp7, Usp8, Usp9x, Uspl1, Uvssa, Vcpip1, Vegfb, Vipas39, Vkorc1, Vps33b, Vrk1, Vrk3, Wac, Wdr45, Wdr45b, Wdr48, Wdr5, Wdr82, Wdsub1, Wdyhv1, Wipi1, Wipi2, Wnk2, Wnk4, Wwp1, Wwtr1, Yeats2, Yes1, Yod1, Ywhae, Zc3h12a, Zdhhc17, Zdhhc2, Zdhhc20, Zdhhc21, Zdhhc3, Zdhhc4, Zdhhc5, Zdhhc6, Zdhhc7, Zdhhc9, Zfp36, Zfp36l1, Zfp36l2, Zfp451, Zfp598, Zmpste24, Znrf1, Znrf2, Znrf3, Zranb1
GO:0006464	BP	e	cellular protein modification process	987/7672	1813/15423	2.1176472904682887e-05	6	987	0.0056866672887186396	1810024B03Rik, Aak1, Abca1, Abhd13, Abhd17a, Abhd17c, Abi2, Abl2, Acp1, Acvr1, Acvr2b, Acvrl1, Adh5, Adprhl2, Agbl5, Agt, Agtr1a, Akt2, Akt3, Alg1, Alg5, Alg8, Alpk1, Amfr, Anapc1, Anapc2, Anapc5, Apoa2, App, Araf, Arel1, Arid4a, Arid4b, Arih2, Arrb1, Arrb2, Arrdc1, Arrdc4, Asb1, Asb2, Ash1l, Ash2l, Asxl1, Atat1, Ate1, Atg12, Atg16l1, Atg4b, Atg5, Atm, Atp7a, Atr, Atxn7, Atxn7l3, Axin1, B3galnt1, B3galt1, Babam1, Bap1, Baz2a, Bcl11a, Bcor, Bcr, Bend3, Bfar, Bgn, Birc2, Birc6, Blk, Bmp10, Bmp2k, Bmpr1a, Bmpr2, Braf, Brap, Brca2, Brcc3, Brd1, Brd4, Brms1l, Brpf1, Brpf3, Brsk1, Btg1, Btg2, Btk, C1galt1, C1galt1c1, Cab39, Cab39l, Cad, Camk1d, Camk2a, Camk2d, Camk4, Camkk2, Cand1, Cbfb, Cbl, Cblb, Cblc, Cbll1, Ccl5, Ccnt1, Cdc14b, Cdc27, Cdc42bpa, Cdc42bpb, Cdc42bpg, Cdc42ep5, Cdc73, Cdk11b, Cdk12, Cdk13, Cdk16, Cdk17, Cdk19, Cdk5r1, Cdk6, Cdk7, Cdk8, Cdk9, Ces2a, Cfl1, Chek1, Chfr, Chm, Chml, Chuk, Clk1, Clk3, Clk4, Clock, Cog3, Cog7, Coprs, Cops3, Cops5, Cops6, Cops7b, Crbn, Creb1, Crebbp, Crtap, Crtc2, Cry1, Csf1r, Csnk1d, Csnk1e, Csnk1g1, Csnk1g2, Csnk1g3, Csnk2a1, Csnk2a2, Csnk2b, Ctcfl, Ctdp1, Ctdsp2, Ctdspl2, Cth, Ctnnb1, Ctr9, Cttnbp2nl, Cul1, Cul3, Cul4b, Cul5, Cul9, Cyld, Dad1, Dapk1, Dcaf17, Dclk2, Dcun1d1, Dcun1d3, Dcun1d4, Dcun1d5, Ddah1, Ddb1, Ddb2, Ddrgk1, Desi2, Dgkq, Dguok, Dhps, Dld, Dlst, Dmpk, Dot1l, Dph1, Dph5, Dph6, Dr1, Dsp, Dstyk, Dtx2, Dtx3, Dtx4, Dusp1, Dusp11, Dusp12, Dusp16, Dusp23, Dusp4, Dusp5, Dusp6, Dusp7, Dusp8, Dyrk1a, Dyrk1b, Dyrk2, E030030I06Rik, Edem1, Edem3, Eed, Egf, Egfr, Egr2, Ehhadh, Ehmt1, Ehmt2, Eif2a, Eif2ak1, Eif2s1, Eif3f, Elk4, Entpd5, Eogt, Ep300, Ep400, Epc1, Ephb3, Ephb4, Erbb2, Erbb4, Ern1, Esco1, Esco2, Etf1, Ext1, Ext2, Extl2, Extl3, Eya3, Eya4, Ezh2, Fam98a, Fbxl17, Fbxl2, Fbxl21, Fbxl3, Fbxl5, Fbxl7, Fbxo11, Fbxo25, Fbxo7, Fbxo9, Fbxw11, Fbxw5, Fbxw7, Fem1b, Fer, Fes, Fgfr1, Fgfr2, Fut11, Fxn, Gak, Galnt18, Gan, Gcnt2, Gcsh, Gdf6, Gfpt1, Gfpt2, Ggcx, Ggnbp1, Gm5239, Golga7, Gphn, Gpx1, Grk4, Grk5, Gsk3a, Gspt1, Gtf2b, Gtf2h1, Gtf2h3, Gxylt1, Hccs, Hcfc1, Hdac2, Hdac3, Hdac4, Hdac5, Hectd1, Hecw2, Hemk1, Herc2, Herc4, Hhat, Hif1an, Hipk1, Hipk2, Hipk3, Hlcs, Hltf, Hmbs, Hsf1, Hspa8, Hspa9, Htatip2, Huwe1, Icmt, Igf1r, Ikbke, Il12rb2, Il15, Il1b, Ilkap, Ing5, Insr, Irak1, Irak2, Irak3, Irgm2, Itch, Itgav, Itpkb, Jak2, Jmjd1c, Jmjd6, Jmjd7, Josd1, Kansl1, Kansl2, Kansl3, Kars, Kat2b, Kat6a, Kat6b, Kat7, Kat8, Kbtbd8, Kcmf1, Kctd13, Kdelc1, Kdm1a, Kdm1b, Kdm2a, Kdm3a, Kdm4b, Kdm4c, Kdm5a, Kdm5b, Kdm5c, Kdm5d, Kdm6a, Kdm6b, Kdm8, Kdr, Klhl12, Klhl13, Klhl2, Klhl20, Klhl21, Klhl24, Klhl3, Klhl41, Klhl42, Klhl7, Kmt2a, Kmt2b, Kmt2c, Kmt2d, Ksr1, Lama1, Lats1, Leo1, Lias, Lmtk2, Loxl4, Ltn1, Lyn, Lypla1, Lztr1, Macrod1, Magt1, Maml1, Man2a1, Man2a2, Man2b1, Map2k4, Map2k5, Map2k7, Map3k1, Map3k11, Map3k13, Map3k14, Map3k15, Map3k2, Map3k3, Map3k4, Map3k5, Map3k7, Map3k8, Map4k2, Map4k3, Map4k4, Map4k5, Mapk1, Mapk15, Mapk3, Mapk8, Mapk8ip3, Mapk9, Mapkapk2, Mapkapk3, Mapkapk5, March2, March5, March6, March7, Mark2, Mast1, Mast4, Mastl, Matk, Mdm2, Meaf6, Med1, Med12, Med17, Med21, Med23, Med24, Med30, Med6, Med7, Mef2a, Met, Metap2, Mettl22, Mfng, Mgat1, Mgat2, Mgat4b, Mgrn1, Mib1, Mier1, Mier2, Mink1, Morc3, Morf4l1, Msl1, Msl2, Mta1, Mta2, Mtfmt, Mtm1, Mtmr3, Mtor, Mul1, Myc, Mycbp2, Myd88, Mylip, Mylk, Mylk3, Mysm1, Naa15, Naa16, Naa25, Naa30, Naa35, Naa40, Naa50, Nae1, Nat8, Nceh1, Ncoa6, Ndst1, Ndufab1, Ndufaf5, Ndufaf7, Nedd4l, Nek1, Nek7, Neurl1a, Neurl3, Nf1, Nfe2l1, Nfe2l2, Nfs1, Ngly1, Nhlrc3, Nktr, Nme2, Nmt2, Nos1, Notum, Npc1, Nr2c2, Nrbp2, Nsd1, Ntrk1, Oard1, Ogfod1, Ogt, Opn3, Otub1, Otud3, Otud5, Otud7b, Oxsr1, P4ha1, P4ha2, Paf1, Pak1, Pak2, Pak4, Pam, Pan3, Park7, Parp2, Parp6, Parp8, Pcgf3, Pcgf6, Pck1, Pcmtd2, Pcnp, Pdgfrb, Pdk1, Pdk2, Pdk3, Pdk4, Pdp2, Pdpk1, Pdzd4, Peli1, Peli2, Peli3, Pex12, Pgap1, Pgap2, Pggt1b, Phb, Phc1, Phf2, Phf20, Phf8, Phkg2, Phlpp1, Phlpp2, Pias1, Pias2, Piga, Pigb, Pigf, Pigk, Pigm, Pign, Pigp, Pigq, Pigt, Pigw, Pik3c3, Pik3ca, Pik3cg, Pik3r4, Pim3, Pink1, Pja1, Pja2, Pkd1, Pkdcc, Pkn1, Pkn2, Plk4, Plod1, Plod3, Pofut1, Pofut2, Pomgnt2, Porcn, Ppid, Ppie, Ppil2, Ppil4, Ppm1a, Ppm1b, Ppm1d, Ppm1e, Ppm1g, Ppm1k, Ppme1, Ppp1ca, Ppp1cc, Ppp1r15a, Ppp1r15b, Ppp1r1b, Ppp1r3c, Ppp2ca, Ppp2cb, Ppp2r2a, Ppp2r2d, Ppp2r3a, Ppp2r5a, Ppp2r5c, Ppp2r5d, Ppp3ca, Ppp3cc, Ppp3r1, Ppp4r2, Ppp5c, Ppp6c, Prdx3, Prkaa1, Prkaa2, Prkab1, Prkar1a, Prkar1b, Prkca, Prkcd, Prkcg, Prkch, Prkd3, Prkx, Prmt1, Prmt2, Prmt3, Prmt6, Prpf19, Prpf4b, Pskh1, Ptger4, Ptp4a2, Ptpn12, Ptpn14, Ptpn2, Ptpn23, Ptpn3, Ptpn9, Ptpra, Ptprb, Ptprd, Ptprf, Ptprk, Ptprm, Ptprn, Ptprs, Pwp1, Pxk, Pxn, Qpct, Rabggtb, Raf1, Ranbp2, Rbbp5, Rbbp6, Rbm14, Rc3h1, Rc3h2, Rchy1, Rcor1, Reln, Rest, Rffl, Rfwd3, Rgr, Rhbdd1, Rictor, Ripk2, Ripk3, Ripk4, Rlf, Rlim, Rnf10, Rnf111, Rnf115, Rnf13, Rnf138, Rnf139, Rnf14, Rnf141, Rnf144a, Rnf144b, Rnf146, Rnf152, Rnf157, Rnf167, Rnf185, Rnf19a, Rnf2, Rnf20, Rnf213, Rnf216, Rnf217, Rnf220, Rnf25, Rnf31, Rnf38, Rnf4, Rnf41, Rnf43, Rnft1, Rock1, Rock2, Rpap2, Rpn2, Rprd1a, Rprd1b, Rps27a, Rps6ka2, Rps6ka5, Rsrc1, Rtf1, Rybp, S100a9, Sash1, Satb1, Scyl2, Scyl3, Sde2, Sdhaf2, Senp1, Senp2, Senp3, Senp5, Senp6, Serp1, Serpina1a, Serpina1b, Setd1a, Setd1b, Setd2, Setd3, Setd6, Setd7, Setdb1, Setx, Sfpq, Sgk1, Sgk2, Sgk3, Sh3rf1, Shank3, Sharpin, Shc1, Shoc2, Shprh, Sik1, Sik2, Sik3, Sin3a, Sin3b, Sirt1, Sirt7, Skp1a, Sla, Slc35c1, Slk, Smad1, Smad4, Smad5, Smad9, Smg1, Smurf2, Smyd3, Snrpb, Snrpd3, Socs6, Socs7, Sox9, Spata2, Spsb2, Spsb4, Src, Srms, Srpk1, Srpk2, Ssh1, Ssh3, Ssu72, St3gal5, St6gal1, St6galnac3, St6galnac4, St8sia1, St8sia4, Stambpl1, Stat5a, Stk16, Stk17b, Stk24, Stk25, Stk3, Stk32c, Stk38, Stk39, Stk4, Stk40, Stradb, Stt3b, Stub1, Suds3, Sumo3, Syvn1, Tada1, Tada2a, Taf1, Taf12, Taf5l, Taf9, Taok1, Tbk1, Tbl1x, Tbl1xr1, Tcf3, Tec, Tesk2, Tet2, Tet3, Tex14, Tgfbr1, Thbs1, Tiparp, Tlk1, Tlk2, Tlr2, Tmem129, Tmtc1, Tmtc2, Tmtc3, Tmx3, Tnfaip3, Tnik, Tnk2, Tnks, Tnks2, Topors, Traf2, Traf6, Traf7, Trib1, Trib3, Trim2, Trim23, Trim27, Trim28, Trim3, Trim30a, Trim33, Trim47, Trim56, Trio, Trip11, Trmt112, Trpc4ap, Trpm7, Trrap, Tsg101, Ttbk2, Ttl, Ttll1, Ttll3, Ttll4, Txk, Uba1, Uba2, Uba52, Ubash3b, Ubb, Ubd, Ube2a, Ube2b, Ube2cbp, Ube2d2b, Ube2d3, Ube2e1, Ube2e3, Ube2g1, Ube2g2, Ube2h, Ube2i, Ube2j2, Ube2k, Ube2m, Ube2o, Ube2q2, Ube2r2, Ube2s, Ube2v1, Ube2v2, Ube3a, Ube3b, Ube4a, Ubl5, Ublcp1, Ubr1, Ubr3, Ubr5, Uchl3, Uchl5, Uevld, Ufl1, Uggt2, Uhmk1, Uhrf2, Ulk1, Ulk3, Usp1, Usp11, Usp14, Usp15, Usp16, Usp19, Usp20, Usp21, Usp22, Usp24, Usp25, Usp27x, Usp28, Usp3, Usp31, Usp33, Usp34, Usp37, Usp38, Usp39, Usp4, Usp46, Usp47, Usp54, Usp7, Usp8, Usp9x, Uspl1, Uvssa, Vcpip1, Vegfb, Vipas39, Vkorc1, Vps33b, Vrk1, Vrk3, Wac, Wdr45, Wdr45b, Wdr48, Wdr5, Wdr82, Wdsub1, Wdyhv1, Wipi1, Wipi2, Wnk2, Wnk4, Wwp1, Wwtr1, Yeats2, Yes1, Yod1, Ywhae, Zc3h12a, Zdhhc17, Zdhhc2, Zdhhc20, Zdhhc21, Zdhhc3, Zdhhc4, Zdhhc5, Zdhhc6, Zdhhc7, Zdhhc9, Zfp36, Zfp36l1, Zfp36l2, Zfp451, Zfp598, Zmpste24, Znrf1, Znrf2, Znrf3, Zranb1
GO:0042738	BP	e	exogenous drug catabolic process	33/7672	40/15423	2.2767070220557563e-05	5	33	0.006002641550332822	Cyp1a2, Cyp2a12, Cyp2a22, Cyp2a4, Cyp2a5, Cyp2b10, Cyp2c29, Cyp2c37, Cyp2c38, Cyp2c40, Cyp2c50, Cyp2c54, Cyp2c55, Cyp2c67, Cyp2c68, Cyp2c69, Cyp2c70, Cyp2d10, Cyp2d11, Cyp2d12, Cyp2d22, Cyp2d26, Cyp2d9, Cyp2e1, Cyp2f2, Cyp2g1, Cyp2j5, Cyp2j6, Cyp2j8, Cyp2j9, Cyp2r1, Cyp4b1, Nos1
GO:0048024	BP	e	regulation of mRNA splicing, via spliceosome	61/7672	84/15423	2.446742049665216e-05	9	61	0.006165965356988201	Akr1c6, C1qbp, Celf1, Ddx5, Dyrk1a, Eif4a3, Fam172a, Hnrnpa2b1, Hnrnpk, Hnrnpu, Hspa8, Jmjd6, Khdrbs1, Khdrbs3, Magoh, Malat1, Mbnl1, Mbnl2, Mbnl3, Npm1, Nup98, Pcbp4, Prdx6, Prpf19, Ptbp1, Ptbp3, Rbfox2, Rbm10, Rbm15, Rbm15b, Rbm17, Rbm3, Rbm4, Rbm42, Rbm4b, Rbm5, Rbm7, Rbmx, Rbmxl1, Rest, Rnps1, Sart3, Sf3b4, Sfswap, Slc39a5, Son, Srek1, Srrm4, Srsf1, Srsf10, Srsf2, Srsf5, Srsf6, Srsf7, Srsf9, Thrap3, Tra2a, Tra2b, U2af2, Ythdc1, Zbtb7a
GO:0009891	BP	e	positive regulation of biosynthetic process	811/7672	1475/15423	2.448358234192282e-05	5	811	0.006165965356988201	Aamdc, Abhd6, Ablim2, Ablim3, Acd, Acsl5, Actr3, Acvr1, Acvr2a, Acvrl1, Adrb2, Afap1l2, Aff1, Ager, Ago2, Agt, Ahi1, Aif1, Akap6, Akap8l, Akirin2, Akna, Akt2, Apoa2, Apobec1, App, Ar, Arfgef1, Arhgef10l, Arhgef11, Arhgef2, Arid1a, Arid4a, Arid4b, Armcx3, Arntl, Arntl2, Arpp19, Arrb1, Arrb2, Ash1l, Ash2l, Asxl1, Asxl2, Atad2b, Atf2, Atf3, Atf4, Atm, Atoh8, Atr, Atrx, Atxn1, Atxn7, Atxn7l3, Avpr1a, Axin1, Bach1, Bag1, Bambi, Batf, Bcl10, Bcl3, Bcl9l, Bclaf1, Bhlha15, Bloc1s2, Bmp10, Bmp6, Bmpr1a, Bmpr2, Bptf, Brca2, Brd4, Brd7, Brdt, Brf1, Brpf1, C1qbp, C3ar1, Calcoco1, Camk2d, Camk4, Camta1, Camta2, Cand1, Card11, Cbfb, Cbx7, Ccl19, Ccl2, Ccl5, Ccnh, Ccnk, Ccnt1, Cct4, Cct5, Cct8, Cd1d1, Cd27, Cd276, Cd36, Cd38, Cd3e, Cd74, Cd81, Cdc42, Cdc5l, Cdc73, Cdh1, Cdk12, Cdk13, Cdk5rap2, Cdk7, Cdk9, Cebpb, Cebpd, Cebpg, Cebpz, Chchd10, Chchd2, Chd6, Chd7, Chek1, Chp1, Chp2, Chuk, Ckap2, Clcn3, Clock, Cnbp, Cnep1r1, Cnot6, Cnot7, Cops5, Cpeb3, Creb1, Creb3l3, Creb5, Crebbp, Crebl2, Crem, Crlf3, Crp, Crtc1, Crtc2, Crtc3, Csrnp1, Csrnp2, Csrp3, Ctcfl, Ctnnb1, Ctr9, Cyba, Cys1, Dbf4, Dcaf6, Dcp1a, Ddah1, Ddb1, Ddit3, Ddrgk1, Ddx39b, Ddx3x, Ddx5, Dgat1, Dhx33, Dhx36, Dhx9, Dicer1, Dll1, Dmtf1, Dot1l, Dr1, Dvl1, Dvl2, Dvl3, Dyrk1b, Dyrk2, E2f3, E2f4, E2f5, E2f6, E2f7, Eaf1, Ebf4, Eef2, Egf, Egfr, Egr1, Egr2, Eif2a, Eif2b5, Eif3c, Eif3e, Eif4a3, Eif4g2, Eif4g3, Eif5a2, Elavl1, Elf1, Elf2, Elk4, Ell2, Elof1, Eng, Ep300, Epas1, Epc1, Erbb2, Erbb4, Ercc3, Ercc6, Ereg, Erg, Erlin2, Esrrb, Esrrg, Ets2, Etv1, Etv5, Exosc9, F2r, F2rl1, Fam129b, Fastkd2, Fbxw11, Fcgr3, Fgf1, Fgfr1, Fgfr2, Flcn, Fli1, Fos, Fosb, Fosl2, Foxa1, Foxa3, Foxj1, Foxj2, Foxj3, Foxk1, Foxk2, Foxo4, Foxp1, Fpr2, Fubp3, Fxr2, Gabpb1, Gabpb2, Gata2, Gata6, Gba, Gcn1l1, Gdf6, Gfer, Gipc1, Gli3, Glis2, Glis3, Glmn, Gmeb1, Gnl3, Gpatch3, Gpbp1, Gpld1, Grhl1, Gsk3a, Gtf2b, Gtf2f2, Gtf2h1, Gzf1, H2-M3, Has3, Hcfc1, Hcls1, Hdac2, Hdac3, Hdac4, Hdac5, Helz2, Hexb, Hgf, Hhex, Hinfp, Hipk2, Hivep2, Hltf, Hmbox1, Hmga1, Hmgb3, Hnf4a, Hnrnpa2b1, Hnrnpk, Hnrnpu, Hoxa1, Hoxa3, Hoxa5, Hoxb4, Hoxb5, Hsd17b13, Hsf1, Hsf2, Hspb1, Hsph1, Htatip2, Hyal2, Icam1, Id2, Ier2, Ier5, Ifnar1, Ift74, Igbp1, Igf1r, Ihh, Ikbkg, Il15, Il1a, Il1b, Ilf2, Impact, Ing1, Ing2, Ing5, Ino80, Inpp5k, Insig2, Insr, Ippk, Irf1, Irf2, Irf2bpl, Irf3, Irf6, Irs1, Irs2, Itga8, Itgb2, Jak2, Jmjd6, Jpx, Jun, Junb, Jund, Kars, Kat2b, Kat6a, Kat6b, Kat7, Kat8, Kctd13, Kdm1a, Kdm3a, Kdm5a, Kdm6b, Kdm8, Kdr, Khdrbs1, Klf10, Klf12, Klf15, Klf2, Klf6, Klf9, Klrk1, Kmt2a, Kmt2c, Kmt2d, Kmt2e, Kpna6, Larp4, Larp4b, Lbp, Leo1, Lgr4, Lmo2, Lmo4, Lpin3, Lrp5, Lrp6, Ltbp1, Lum, Mad2l2, Maf, Maff, Maml1, Mamstr, Map2k4, Map2k5, Map2k7, Map3k2, Map3k4, Map3k5, Mapk1, Mapk15, Mapk3, Mapk8, Mapk9, Mapkapk2, Mapkapk5, Mapre3, Mas1, Maz, Mbtps2, Mcf2l, Mdfic, Med1, Med12, Med13, Med14, Med17, Med21, Med24, Med25, Med30, Med6, Mef2a, Mef2d, Met, Mga, Mical2, Mief1, Mllt11, Mllt6, Mlxip, Mlxipl, Mmp8, Mms19, Mnat1, Mospd1, Msantd1, Mta2, Mtf2, Mtor, Mtpn, Myc, Myd88, Myo6, Myrf, Mysm1, Mzf1, Naa15, Nat10, Nck2, Ncoa2, Ncoa3, Ncoa6, Ncoa7, Ncstn, Nek7, Nelfa, Nfat5, Nfatc1, Nfatc2, Nfatc2ip, Nfatc3, Nfe2l1, Nfe2l2, Nfia, Nfib, Nfil3, Nfix, Nfkb1, Nfkb2, Nfkbia, Nipbl, Nkrf, Nkx2-6, Nlrc5, Nlrp12, Nlrp3, Nme2, Nod2, Nol11, Nos1, Notch1, Nox4, Npas2, Npat, Npm1, Npnt, Nr1h2, Nr1h5, Nr1i3, Nr2c2, Nr2f2, Nr4a1, Nr5a2, Nr6a1, Nrip1, Nsd1, Nsun4, Nucks1, Nufip1, Nup62, Ogt, Onecut2, P2ry1, Paf1, Park7, Parn, Patz1, Pawr, Pax9, Paxbp1, Paxip1, Pbrm1, Pbx1, Pcbd2, Pck1, Pdgfrb, Peg3, Pfkm, Pfn1, Phb, Phf1, Phf10, Phf19, Phf2, Phf5a, Phf8, Phip, Pias1, Pias2, Picalm, Pid1, Pih1d1, Pink1, Pitx3, Pkd1, Pkd2, Pknox1, Pla2g6, Plac8, Plagl1, Plagl2, Plcb1, Plcd1, Plin5, Plscr1, Pmel, Pnkp, Pot1a, Pou2f2, Ppm1a, Ppp1r15a, Ppp1r3g, Ppp2r5d, Ppp3ca, Ppp3r1, Pprc1, Prdm15, Prdm16, Prdm2, Prdm4, Prdx5, Prkaa1, Prkcd, Prmt1, Prmt2, Prpf6, Psip1, Psmc6, Ptbp1, Ptger4, Ptges3, Ptpn2, Ptprn, Pus1, Pwp1, Rab38, Rab3gap1, Rab3gap2, Rac1, Raf1, Rapgef3, Rarg, Rasl11a, Rb1, Rbm14, Rbm15, Rbm3, Rbm4, Rbms3, Rbmx, Rbmxl1, Rdh10, Rel, Rela, Relb, Rest, Rexo4, Rfx4, Rfxank, Rgmb, Rhog, Rhoq, Rnf10, Rnf111, Rnf14, Rnf20, Rnf4, Rpl26, Rpl5, Rprd1b, Rps27l, Rps3a1, Rps6ka5, Rptor, Rpusd3, Rrn3, Rsf1, Rtf1, Rxrb, Rybp, Safb, Sall1, Samd4, Satb2, Sbno2, Scarb1, Senp1, Senp2, Serp1, Serpine1, Serpinf2, Sertad1, Sertad3, Sesn2, Setd1a, Setd3, Setd7, Setx, Sfpq, Shc1, Sin3a, Sirt1, Sirt7, Skap1, Slc27a1, Slc30a9, Slc35a4, Slc45a3, Slc9a1, Smad1, Smad4, Smad5, Smad6, Smad9, Smarca5, Smarcb1, Smarcc1, Smarcc2, Smarcd1, Smarcd3, Smo, Smyd3, Soat1, Sod2, Sox12, Sox13, Sox17, Sox18, Sox5, Sox9, Sp3, Spic, Sra1, Src, Srf, Ss18l1, Ssbp4, Star, Stat3, Stat5a, Stat5b, Stat6, Stk16, Stoml2, Strn3, Supt16, Supt4a, Supt5, Supt6, Taf1, Taf4b, Taf6, Taf9, Tal1, Tasp1, Taz, Tbk1, Tbl1x, Tbl1xr1, Tbp, Tbpl1, Tbx20, Tbx3, Tbx6, Tcea1, Tcea2, Tcf20, Tcf21, Tcf3, Tcf7l2, Tcp1, Tead1, Tead3, Tet2, Tet3, Tfam, Tfb2m, Tfcp2, Tfdp2, Tfe3, Tfec, Tgfbr1, Thbs1, Thoc1, Thra, Thrap3, Thrb, Tirap, Tlr1, Tlr2, Tlr6, Tmem173, Tmprss6, Tnfrsf1a, Tnip1, Tnip2, Tnks, Topors, Traf6, Trim28, Trmt10c, Trp53, Trp53bp1, Trp53inp1, Trpv1, Trub2, Tsc2, Twist1, Txk, Tyrobp, Ube3a, Ubtf, Uhmk1, Upf3a, Upf3b, Uqcc2, Usf2, Usp16, Usp21, Usp22, Utp15, Vezf1, Vps35, Wac, Wdr43, Wdr5, Wdr75, Wiz, Wwtr1, Xbp1, Xrcc5, Xrcc6, Yaf2, Yap1, Ybx1, Yes1, Ythdf1, Ythdf2, Ythdf3, Yy1, Zbtb16, Zbtb17, Zbtb38, Zbtb49, Zbtb7b, Zc3h12a, Zfhx2, Zfhx3, Zfhx4, Zfp131, Zfp148, Zfp281, Zfp287, Zfp292, Zfp296, Zfp318, Zfp326, Zfp358, Zfp384, Zfp423, Zfp516, Zfp593, Zfp609, Zfp628, Zfp639, Zfp715, Zfp90, Zfp930, Zkscan17, Zkscan3, Zmiz2, Zscan2, Zscan21, Zxdc, mt-Co2
